{
  "notification_id": "223093ef-57a5-5f4d-a6b3-7d42c26acf81",
  "tenant_id": "286ea0c9-1360-5574-84ae-b88f28527610",
  "reset_epoch": 1,
  "workflow_id": "beedb39b-bf5b-5e09-8b6a-35d3c847c4ee",
  "kind": "lawyer_review_request",
  "recipient_actor_id": "3ff0409c-60a2-5817-8e24-18526415754e",
  "channel": "email",
  "mode": "live",
  "state": "pending",
  "review_bundle_id": "f660de0e-5a11-5782-ba17-46d096f61d03",
  "revision_id": "72c7ae26-80b8-54ea-8011-92581d79392d",
  "template_version": "review-request-v1",
  "rendered_payload_ref": "0e21c8ae-f5f0-5daf-8a0a-2ee6aeac0fe7",
  "payload_hash": "e5afbee3a2eaaba8364c16e91b40affde7a8f817c0f81e54d177ca658f656002",
  "provider": "resend",
  "provider_idempotency_key": "kiara/1/223093ef-57a5-5f4d-a6b3-7d42c26acf81",
  "first_attempt_at": null,
  "retry_until": null,
  "provider_message_id": null,
  "attempt_count": 0,
  "available_at": "2026-09-26T17:00:00Z",
  "lease_epoch": 0,
  "lease_owner": null,
  "lease_expires_at": null,
  "created_at": "2026-09-26T17:00:00Z"
}
